{
  "rule_id": "R1",
  "name": "高ACoS低CTR渠道创意不匹配",
  "evaluation_grain": { "time": "14day", "entity": "campaign" },
  "attribution_model": null,
  "trigger_condition": {
    "all": [
      { "concept": "acos", "op": ">", "ref": "baseline*1.3", "window_days": 14 },
      { "concept": "ctr", "op": "<", "ref": "baseline*0.6", "window_days": 14 }
    ]
  },
  "diagnosis": "该campaign的ACoS显著高于账户基准且CTR显著低于基准，提示渠道/创意与目标受众不匹配",
  "recommended_action": {
    "type": "review_creative_and_targeting",
    "param": { "priority": 1 }
  },
  "match_inputs": [
    { "concept": "acos", "role": "trigger_signal", "required": true },
    { "concept": "ctr", "role": "comparison_signal", "required": true }
  ],
  "confidence_model": {
    "source": ["historical_pattern", "data_quality"],
    "thresholds": { "auto": 0.7, "review": 0.5 }
  },
  "risk_model": {
    "impact_score": 0.55,
    "formula": "impact_score * (1 - confidence)",
    "auto_execute_threshold": 0.25,
    "review_threshold": 0.6
  },
  "execution_policy": {
    "mode": "review",
    "reason": "涉及创意与策略调整，建议人工复核"
  },
  "confidence": 0.65,
  "risk_level": "MEDIUM",
  "evidence_type": "historical_pattern",
  "validation_count": 0,
  "rejection_count": 0,
  "version_history": [
    {
      "version": "1.0",
      "date": "2026-07-17",
      "author": "human_expert",
      "change": "初始版本，沿用 R-042 触发逻辑，基准由行业CTR均值改为账户内生基准，评估窗口由7天订正为14天"
    }
  ],
  "causal_annotation": "相关性证据，非因果证明"
,
  "status": "ACTIVE"
}
